{
  "schema_version": "2.0.0",
  "category": "git",
  "updated_at": "2026-02-22T00:00:00Z",
  "patterns": [
    {
      "pattern_id": "git_authentication_failed",
      "version": "1.0.0",
      "name": "Git Authentication Failed",
      "category": "git",
      "subcategory": "auth",
      "severity": "critical",
      "tags": ["git", "authentication", "token", "credentials", "CI"],
      "detection": {
        "regex": "fatal: Authentication failed for '(.+)'|remote: Invalid username or password|could not read Username",
        "keywords_required": ["Authentication failed", "could not read Username"],
        "keywords_optional": ["fatal", "remote", "https", "username", "password", "token"],
        "exclude_if": ["npm", "docker", "pip"],
        "file_patterns": [".github/workflows/*.yml"],
        "variables": {
          "repo_url": {
            "from": "regex_group_1",
            "transform": "strip",
            "default": "unknown-repo"
          }
        }
      },
      "solutions": [
        {
          "rank": 1,
          "title": "Configure GitHub token in CI",
          "command_template": "git config --global url.\"https://$GITHUB_TOKEN@github.com/\".insteadOf \"https://github.com/\"",
          "explanation": "In CI, GitHub HTTPS authentication requires a token. Use `GITHUB_TOKEN` (automatically provided in GitHub Actions) or a Personal Access Token (PAT) stored as a secret. Add: `git config --global url.\"https://$TOKEN@github.com/\".insteadOf \"https://github.com/\"`.",
          "confidence": 0.92,
          "risk": "none",
          "reversible": true,
          "affects_files": false,
          "requires_confirmation": false,
          "variables_used": ["repo_url"]
        },
        {
          "rank": 2,
          "title": "Check token permissions",
          "explanation": "The PAT or deploy key may lack required scopes. For GitHub: ensure the token has `repo` (private repos) or `public_repo` (public) scope. Check token expiration.",
          "confidence": 0.88,
          "risk": "none",
          "reversible": true,
          "affects_files": false,
          "requires_confirmation": false
        },
        {
          "rank": 3,
          "title": "Switch to SSH authentication",
          "explanation": "Configure an SSH deploy key for the repository (Settings → Deploy keys). Use `git clone git@github.com:org/repo.git` instead of HTTPS. SSH doesn't require token management.",
          "confidence": 0.8,
          "risk": "none",
          "reversible": true,
          "affects_files": true,
          "requires_confirmation": false
        }
      ],
      "causal_chain": {
        "often_caused_by": [],
        "often_causes": ["git_remote_rejected"]
      },
      "metadata": {
        "created_at": "2026-02-22T00:00:00Z",
        "updated_at": "2026-02-22T00:00:00Z",
        "author": "opshero-team",
        "source": "core",
        "stats": { "matched_count": 0, "helpful_count": 0, "not_helpful_count": 0, "success_rate": null }
      }
    },
    {
      "pattern_id": "git_branch_protection",
      "version": "1.0.0",
      "name": "Git Branch Protection Violation",
      "category": "git",
      "subcategory": "policy",
      "severity": "high",
      "tags": ["git", "branch-protection", "main", "policy", "PR"],
      "detection": {
        "regex": "protected branch hook declined|cannot push to protected branch|remote: error: GH006|remote: error: changes must be made through a pull request",
        "keywords_required": ["protected branch"],
        "keywords_optional": ["hook declined", "GH006", "pull request required", "changes must be made"],
        "exclude_if": [],
        "file_patterns": [],
        "variables": {}
      },
      "solutions": [
        {
          "rank": 1,
          "title": "Create a pull request instead",
          "explanation": "You attempted to push directly to a protected branch (e.g. `main`, `master`, `production`). The organization requires all changes to go through a Pull Request with code review and CI checks passing.",
          "confidence": 0.95,
          "risk": "none",
          "reversible": true,
          "affects_files": false,
          "requires_confirmation": false
        },
        {
          "rank": 2,
          "title": "Check required status checks",
          "explanation": "Even if you create a PR, it may require specific CI checks to pass before merge. Ensure all required status checks in the branch protection rules are satisfied.",
          "confidence": 0.85,
          "risk": "none",
          "reversible": true,
          "affects_files": false,
          "requires_confirmation": false
        }
      ],
      "causal_chain": {
        "often_caused_by": [],
        "often_causes": []
      },
      "metadata": {
        "created_at": "2026-02-22T00:00:00Z",
        "updated_at": "2026-02-22T00:00:00Z",
        "author": "opshero-team",
        "source": "core",
        "stats": { "matched_count": 0, "helpful_count": 0, "not_helpful_count": 0, "success_rate": null }
      }
    },
    {
      "pattern_id": "git_merge_conflict",
      "version": "1.0.0",
      "name": "Git Merge Conflict",
      "category": "git",
      "subcategory": "merge",
      "severity": "high",
      "tags": ["git", "merge", "conflict", "rebase"],
      "detection": {
        "regex": "CONFLICT \\(|Merge conflict in (.+)|Automatic merge failed|fix conflicts and then commit the result",
        "keywords_required": ["CONFLICT", "Merge conflict"],
        "keywords_optional": ["Automatic merge failed", "fix conflicts", "<<<<<<", "=======", ">>>>>>>"],
        "exclude_if": ["npm", "docker", "pip"],
        "file_patterns": [],
        "variables": {
          "conflicted_file": {
            "from": "regex_group_1",
            "transform": "strip",
            "default": "unknown-file"
          }
        }
      },
      "solutions": [
        {
          "rank": 1,
          "title": "Resolve conflict markers manually",
          "explanation": "Open the conflicted files. Find sections marked with `<<<<<<<`, `=======`, `>>>>>>>` and decide which changes to keep (yours, theirs, or a combination). Then: `git add <file> && git commit`.",
          "confidence": 0.92,
          "risk": "medium",
          "reversible": true,
          "affects_files": true,
          "requires_confirmation": true,
          "variables_used": ["conflicted_file"]
        },
        {
          "rank": 2,
          "title": "Abort merge and try rebase",
          "command_template": "git merge --abort && git pull --rebase origin main",
          "explanation": "Abort the merge with `git merge --abort`, then use `git pull --rebase` instead of merge. Rebase creates a linear history and conflicts are easier to resolve one commit at a time.",
          "confidence": 0.88,
          "risk": "low",
          "reversible": true,
          "affects_files": false,
          "requires_confirmation": false
        },
        {
          "rank": 3,
          "title": "Use a visual merge tool",
          "command_template": "git mergetool",
          "explanation": "Run `git mergetool` to launch a 3-way diff tool (VS Code, vimdiff, meld) to resolve conflicts visually. Configure your preferred tool: `git config --global merge.tool vscode`.",
          "confidence": 0.82,
          "risk": "none",
          "reversible": true,
          "affects_files": true,
          "requires_confirmation": false
        }
      ],
      "causal_chain": {
        "often_caused_by": [],
        "often_causes": ["git_remote_rejected"]
      },
      "metadata": {
        "created_at": "2026-02-22T00:00:00Z",
        "updated_at": "2026-02-22T00:00:00Z",
        "author": "opshero-team",
        "source": "core",
        "stats": { "matched_count": 0, "helpful_count": 0, "not_helpful_count": 0, "success_rate": null }
      }
    },
    {
      "pattern_id": "git_submodule_error",
      "version": "1.0.0",
      "name": "Git Submodule Error",
      "category": "git",
      "subcategory": "submodules",
      "severity": "high",
      "tags": ["git", "submodule", "recursive", "CI"],
      "detection": {
        "regex": "submodule.*failed|fatal: .*submodule|Unable to find current revision",
        "keywords_required": ["submodule"],
        "keywords_optional": ["failed", "Unable to find", "recursive", "init", ".gitmodules"],
        "exclude_if": [],
        "file_patterns": [".gitmodules", ".github/workflows/*.yml"],
        "variables": {}
      },
      "solutions": [
        {
          "rank": 1,
          "title": "Initialize and update all submodules",
          "command_template": "git submodule update --init --recursive",
          "explanation": "Submodules are not initialized or are out of date. Run `git submodule update --init --recursive` to initialize and fetch all nested submodules.",
          "confidence": 0.92,
          "risk": "none",
          "reversible": true,
          "affects_files": false,
          "requires_confirmation": false
        },
        {
          "rank": 2,
          "title": "Enable submodules in GitHub Actions checkout",
          "explanation": "In GitHub Actions, `actions/checkout` doesn't fetch submodules by default. Add `submodules: recursive` to the checkout step: `uses: actions/checkout@v4 with: submodules: recursive`.",
          "confidence": 0.9,
          "risk": "none",
          "reversible": true,
          "affects_files": true,
          "requires_confirmation": false
        },
        {
          "rank": 3,
          "title": "Authenticate for private submodules",
          "explanation": "Private submodule repos require authentication. Configure git credentials before checkout, or use SSH submodule URLs with a deploy key that has access to both the main repo and submodule repos.",
          "confidence": 0.85,
          "risk": "none",
          "reversible": true,
          "affects_files": false,